{
  "task_type": "DOCS_ONLY",
  "task_summary": "Add a read-only schematic human-drafting quality checker, wire it into repo docs and schematic prompts, validate it on ESP32_CSI_WIFI_NODE, and create the required closeout artifacts without editing KiCad design files.",
  "project_path": ".",
  "target_pcb": null,
  "changed_files": [
    "03_TOOLS/scripts/schematic_quality/check_schematic_human_drafting_quality.py",
    "03_TOOLS/scripts/schematic_quality/README.md",
    "34_SCHEMATIC_QUALITY_ENGINE/README.md",
    "34_SCHEMATIC_QUALITY_ENGINE/SCHEMATIC_READABILITY_STANDARD.md",
    "34_SCHEMATIC_QUALITY_ENGINE/SCHEMATIC_VISUAL_AUDIT_RULES.md",
    ".prompts/shared/HUMAN_DRAFTING_MODE.md",
    ".prompts/kicad_pipeline/02_schematic_visual_cleanup.md",
    ".prompts/kicad_pipeline/03_schematic_visual_repair.md",
    ".prompts/codex/06_REVIEW_SCHEMATIC.md",
    ".prompts/claude/06_REVIEW_SCHEMATIC.md",
    "README_GPT.md",
    "FOR CHAT GPT.MD",
    "04_KICAD_PROJECTS/active/ESP32_CSI_WIFI_NODE/reports/schematic_quality/20260514_165956/human_drafting_quality.json",
    "04_KICAD_PROJECTS/active/ESP32_CSI_WIFI_NODE/reports/schematic_quality/20260514_165956/human_drafting_quality.md",
    "05_OUTPUTS/release_readiness/SCHEMATIC_HUMAN_DRAFTING_CHECKER_REPORT.md",
    "02_HISTORY/sessions/SCHEMATIC_HUMAN_DRAFTING_CHECKER_SESSION.md",
    "02_HISTORY/command_logs/SCHEMATIC_HUMAN_DRAFTING_CHECKER_COMMANDS.md",
    "02_HISTORY/ai_self_reviews/SCHEMATIC_HUMAN_DRAFTING_CHECKER_AI_SELF_REVIEW.md",
    "02_HISTORY/ai_scorecards/SCHEMATIC_HUMAN_DRAFTING_CHECKER_SCORECARD.md",
    "02_HISTORY/claim_evidence_matrices/SCHEMATIC_HUMAN_DRAFTING_CHECKER_CLAIM_EVIDENCE_MATRIX.md",
    "02_HISTORY/uncertainty_logs/SCHEMATIC_HUMAN_DRAFTING_CHECKER_UNCERTAINTY_LOG.md",
    "02_HISTORY/hallucination_risk_logs/SCHEMATIC_HUMAN_DRAFTING_CHECKER_HALLUCINATION_RISK_LOG.md",
    "02_HISTORY/failed_attempts/SCHEMATIC_HUMAN_DRAFTING_CHECKER_FAILED_ATTEMPTS.md",
    "02_HISTORY/issue_logs/SCHEMATIC_HUMAN_DRAFTING_CHECKER_FOLLOWUP.md",
    "05_OUTPUTS/release_readiness/SCHEMATIC_HUMAN_DRAFTING_CHECKER_TASK_CONTRACT.json",
    "05_OUTPUTS/release_readiness/SCHEMATIC_HUMAN_DRAFTING_CHECKER_TASK_CONTRACT_REPORT.md",
    "00_CODEX_START/REPO_INDEX.generated.json",
    "00_CODEX_START/REPO_INDEX.generated.md",
    "01_MEMORY/MASTER_MEMORY_INDEX.md",
    "00_CODEX_START/MEMORY_INDEX.generated.json",
    "00_CODEX_START/MEMORY_INDEX.generated.md",
    "02_HISTORY/MASTER_HISTORY_INDEX.md",
    "00_CODEX_START/HISTORY_INDEX.generated.json",
    "00_CODEX_START/HISTORY_INDEX.generated.md",
    "00_CODEX_START/CURRENT_KNOWN_PROBLEMS.md"
  ],
  "declared_final_status": "VALID_TASK_CONTRACT",
  "notes": "Tooling/docs/report task only. No KiCad schematic, PCB, project, or fabrication-source edits were allowed.",
  "evidence": {
    "backup_created": false,
    "drc_run": false,
    "visual_export_attempted": false
  }
}
