{
  "task_type": "LIVE_STATE_RECONCILE",
  "task_summary": "Drain the final live knowledge_scrape/_scripts residue into canonical history-only storage, reconcile the last unresolved migration-ledger rows, and refresh migration status for final validation rerun.",
  "project_path": "C:\\Users\\LJ\\GitHub\\KICAD_ENGINE",
  "target_pcb": null,
  "changed_files": [
    "03_TOOLS\\scripts\\knowledge_migration\\knowledge_migration_config.json",
    "03_TOOLS\\scripts\\knowledge_migration\\README.md",
    "03_TOOLS\\scripts\\knowledge_migration\\SCRIPT_MIGRATION_NOTES.md",
    "01_MEMORY\\DESIGN_RULES_MEMORY.md",
    "01_MEMORY\\MASTER_MEMORY_INDEX.md",
    "02_HISTORY\\MASTER_HISTORY_INDEX.md",
    "00_CODEX_START\\AI_QUALITY_INDEX.generated.json",
    "00_CODEX_START\\AI_QUALITY_INDEX.generated.md",
    "00_CODEX_START\\CURRENT_KNOWN_PROBLEMS.generated.json",
    "00_CODEX_START\\CURRENT_KNOWN_PROBLEMS.md",
    "00_CODEX_START\\HISTORY_INDEX.generated.json",
    "00_CODEX_START\\HISTORY_INDEX.generated.md",
    "00_CODEX_START\\MEMORY_INDEX.generated.json",
    "00_CODEX_START\\MEMORY_INDEX.generated.md",
    "00_CODEX_START\\REPO_INDEX.generated.json",
    "00_CODEX_START\\REPO_INDEX.generated.md",
    "README_GPT.md",
    "FOR CHAT GPT.MD",
    "02_HISTORY\\knowledge_scrape_migration\\SCRIPT_DRAIN_RECORD.md",
    "02_HISTORY\\knowledge_scrape_migration\\obsolete_scripts\\01_build_raw_inventory.ps1",
    "02_HISTORY\\knowledge_scrape_migration\\obsolete_scripts\\02_build_url_registry.ps1",
    "02_HISTORY\\knowledge_scrape_migration\\obsolete_scripts\\03_classify_copy_markdown.ps1",
    "02_HISTORY\\knowledge_scrape_migration\\obsolete_scripts\\04_convert_pdfs_to_markdown.ps1",
    "02_HISTORY\\knowledge_scrape_migration\\obsolete_scripts\\05_clean_markdown_for_ai.ps1",
    "02_HISTORY\\knowledge_scrape_migration\\obsolete_scripts\\06_build_category_indexes.ps1",
    "02_HISTORY\\knowledge_scrape_migration\\obsolete_scripts\\10_import_ingest_v2.ps1",
    "05_OUTPUTS\\release_readiness\\KNOWLEDGE_SCRAPE_DESTINATION_MAP.md",
    "05_OUTPUTS\\release_readiness\\KNOWLEDGE_SCRAPE_MIGRATION_LEDGER.csv",
    "05_OUTPUTS\\release_readiness\\KNOWLEDGE_SCRAPE_MIGRATION_STATUS.md",
    "05_OUTPUTS\\release_readiness\\KNOWLEDGE_SCRAPE_SCRIPT_DRAIN_REPORT.md",
    "02_HISTORY\\sessions\\KNOWLEDGE_SCRAPE_SCRIPT_DRAIN_SESSION.md",
    "02_HISTORY\\command_logs\\KNOWLEDGE_SCRAPE_SCRIPT_DRAIN_COMMANDS.md",
    "02_HISTORY\\ai_self_reviews\\20260512_KNOWLEDGE_SCRAPE_SCRIPT_DRAIN_SELF_REVIEW.md",
    "02_HISTORY\\ai_scorecards\\20260512_KNOWLEDGE_SCRAPE_SCRIPT_DRAIN_SCORECARD.md",
    "02_HISTORY\\claim_evidence_matrices\\20260512_KNOWLEDGE_SCRAPE_SCRIPT_DRAIN_CLAIMS.md",
    "02_HISTORY\\uncertainty_logs\\20260512_KNOWLEDGE_SCRAPE_SCRIPT_DRAIN_UNCERTAINTY.md",
    "02_HISTORY\\hallucination_risk_logs\\20260512_KNOWLEDGE_SCRAPE_SCRIPT_DRAIN_RISK_LOG.md"
  ],
  "declared_final_status": "VALID_TASK_CONTRACT",
  "notes": "Non-KiCad migration-state reconcile task. Final emptying of knowledge_scrape remains a separate gated step after rerunning final validation.",
  "evidence": {
    "backup_created": false,
    "backup_path": "",
    "no_design_change_needed": true,
    "drc_run": false,
    "visual_export_attempted": false,
    "knowledge_scrape_file_count_before": 7,
    "knowledge_scrape_file_count_after": 0,
    "unresolved_rows_before": 50,
    "unresolved_rows_after": 0,
    "scripts_found": 7,
    "scripts_moved": 7,
    "scripts_history_only": 7,
    "kicad_design_files_changed": false
  }
}
