{
  "task_type": "DOCS_ONLY",
  "task_summary": "Add a read-only mechanical orientation truth layer, connector and ESP32 antenna orientation audits, and prelayout/prompt gate updates without editing KiCad design files.",
  "project_path": "04_KICAD_PROJECTS/active/ESP32_CSI_WIFI_NODE",
  "target_pcb": null,
  "changed_files": [
    "08_COMPONENT_DATABASE/INDEX.md",
    "08_COMPONENT_DATABASE/mechanical_orientation/README.md",
    "08_COMPONENT_DATABASE/mechanical_orientation/connector_orientation_truth.json",
    "08_COMPONENT_DATABASE/mechanical_orientation/barrel_jack_orientation_rules.md",
    "08_COMPONENT_DATABASE/mechanical_orientation/usb_c_orientation_rules.md",
    "08_COMPONENT_DATABASE/mechanical_orientation/esp32_module_antenna_orientation_rules.md",
    "08_COMPONENT_DATABASE/mechanical_orientation/connector_orientation_examples.md",
    "03_TOOLS/scripts/mechanical_orientation/_mechanical_orientation_common.py",
    "03_TOOLS/scripts/mechanical_orientation/audit_connector_orientation.py",
    "03_TOOLS/scripts/mechanical_orientation/audit_barrel_jack_orientation.py",
    "03_TOOLS/scripts/mechanical_orientation/audit_usb_c_orientation.py",
    "03_TOOLS/scripts/mechanical_orientation/audit_esp32_antenna_orientation.py",
    "14_LAYOUT_AUTOMATION/scripts/_placement_common.py",
    "03_TOOLS/scripts/pcb_prelayout/_prelayout_common.py",
    "03_TOOLS/scripts/pcb_prelayout/score_placement_variant.py",
    "33_PCB_PRELAYOUT_ENGINE/CONNECTOR_MECHANICAL_TRUTH_SCHEMA.md",
    "33_PCB_PRELAYOUT_ENGINE/PCB_VARIANT_SCORING_RULES.md",
    "33_PCB_PRELAYOUT_ENGINE/schemas/component_physical_model.schema.json",
    "33_PCB_PRELAYOUT_ENGINE/schemas/connector_orientation_truth.schema.json",
    "09_ACCURACY_ENGINE/pcb_rules/BARREL_JACK_ORIENTATION_RULES.md",
    "09_ACCURACY_ENGINE/pcb_rules/CONNECTOR_EDGE_ORIENTATION_RULES.md",
    "09_ACCURACY_ENGINE/pcb_rules/CONNECTOR_ORIENTATION_RULES.md",
    "09_ACCURACY_ENGINE/pcb_rules/ESP32_RF_KEEP_OUT_PLACEMENT_RULES.md",
    ".prompts/kicad_pipeline/08_pcb_mechanical_setup.md",
    ".prompts/kicad_pipeline/09_pcb_placement_pass_1.md",
    ".prompts/kicad_pipeline/10_pcb_placement_pass_2_orientation.md",
    ".prompts/kicad_pipeline/13_routing_plan_only.md",
    ".prompts/kicad_pipeline/14_route_critical_nets.md",
    ".prompts/kicad_pipeline/15_route_remaining_nets.md",
    ".prompts/kicad_pipeline/16_final_pcb_verification.md",
    ".prompts/kicad_pipeline/17_export_not_final_fab_package.md",
    "README_GPT.md",
    "FOR CHAT GPT.MD",
    "01_MEMORY/DESIGN_RULES_MEMORY.md",
    "04_KICAD_PROJECTS/active/ESP32_CSI_WIFI_NODE/memory/PROJECT_MEMORY.md"
  ],
  "declared_final_status": "VALID_TASK_CONTRACT",
  "notes": "This run must not edit .kicad_sch, .kicad_pcb, or .kicad_pro files. Dry-run validation may read live boards and sample boards only.",
  "evidence": {
    "backup_created": false,
    "no_design_change_needed": true,
    "drc_run": false,
    "visual_export_attempted": false
  }
}
