{
  "task_type": "AUDIT_ONLY",
  "task_summary": "Check whether ESP32_CSI_WIFI_NODE may start GND copper pours and stitching, and stop before any PCB edit if real staged routing is not ready for copper pour.",
  "project_path": "04_KICAD_PROJECTS/active/ESP32_CSI_WIFI_NODE",
  "target_pcb": null,
  "changed_files": [
    "04_KICAD_PROJECTS\\active\\ESP32_CSI_WIFI_NODE\\reports\\COPPER_POUR_GND_ZONE_REPORT.md",
    "04_KICAD_PROJECTS\\active\\ESP32_CSI_WIFI_NODE\\reports\\COPPER_POUR_DRC_REPORT.md",
    "04_KICAD_PROJECTS\\active\\ESP32_CSI_WIFI_NODE\\reports\\RF_KEEP_OUT_COPPER_AUDIT.md",
    "04_KICAD_PROJECTS\\active\\ESP32_CSI_WIFI_NODE\\_verification\\pcb_visual\\COPPER_POUR_REVIEW.md",
    "04_KICAD_PROJECTS\\active\\ESP32_CSI_WIFI_NODE\\memory\\PROMPT_COUNTER.md",
    "04_KICAD_PROJECTS\\active\\ESP32_CSI_WIFI_NODE\\memory\\CURRENT_BLOCKERS.md",
    "04_KICAD_PROJECTS\\active\\ESP32_CSI_WIFI_NODE\\memory\\PROJECT_MEMORY.md",
    "02_HISTORY\\sessions\\2026-05-10_copper_pour_request_block_task_contract.json",
    "02_HISTORY\\sessions\\20260510_COPPER_POUR_REQUEST_BLOCKED_SESSION.md",
    "02_HISTORY\\command_logs\\20260510_COPPER_POUR_REQUEST_BLOCKED_COMMANDS.md",
    "02_HISTORY\\quality_gate_failures\\20260510_COPPER_POUR_REQUEST_BLOCKED.md",
    "02_HISTORY\\issue_logs\\20260510_ESP32_CSI_WIFI_NODE_COPPER_POUR_REQUEST_BLOCKED.md",
    "02_HISTORY\\ai_self_reviews\\20260510_COPPER_POUR_REQUEST_BLOCKED_SELF_REVIEW.md",
    "02_HISTORY\\ai_scorecards\\20260510_COPPER_POUR_REQUEST_BLOCKED_SCORECARD.md",
    "02_HISTORY\\claim_evidence_matrices\\20260510_COPPER_POUR_REQUEST_BLOCKED_CLAIM_EVIDENCE.md",
    "02_HISTORY\\uncertainty_logs\\20260510_COPPER_POUR_REQUEST_BLOCKED_UNCERTAINTY.md",
    "02_HISTORY\\hallucination_risk_logs\\20260510_COPPER_POUR_REQUEST_BLOCKED_HALLUCINATION_RISK.md",
    "FOR CHAT GPT.MD"
  ],
  "declared_final_status": "VALID_TASK_CONTRACT",
  "notes": "The user requested live GND pours, but the run must stop unless the staged-routing report explicitly says REAL_ROUTING_READY_FOR_COPPER_POUR. It does not, so this run is a read-only blocker audit only.",
  "evidence": {
    "backup_created": false,
    "no_design_change_needed": true,
    "drc_run": false,
    "visual_export_attempted": false,
    "pcb_hash_before": "ACA326C7B7C96AA67FED119E8DF54BDEBF80148C6B5F34F998780137C2BA1DD1",
    "pcb_hash_after": "ACA326C7B7C96AA67FED119E8DF54BDEBF80148C6B5F34F998780137C2BA1DD1"
  }
}
