{
  "task_type": "AUDIT_ONLY",
  "task_summary": "Run a full repo integrity audit after the knowledge_scrape migration, rebuild canonical indexes, validate startup/knowledge routing, scan for security and public-payload issues, and record the active ESP32 project status without editing KiCad design files.",
  "project_path": "C:\\Users\\LJ\\GitHub\\KICAD_ENGINE",
  "target_pcb": null,
  "changed_files": [
    "04_KICAD_PROJECTS\\active\\ESP32_CSI_WIFI_NODE\\memory\\PROMPT_COUNTER.md",
    "04_KICAD_PROJECTS\\active\\ESP32_CSI_WIFI_NODE\\reports\\MAINTENANCE_CYCLE_REPORT.json",
    "04_KICAD_PROJECTS\\active\\ESP32_CSI_WIFI_NODE\\reports\\MAINTENANCE_CYCLE_REPORT.md",
    "05_OUTPUTS\\release_readiness\\POST_KNOWLEDGE_MIGRATION_REPO_INTEGRITY_AUDIT.md",
    "05_OUTPUTS\\release_readiness\\POST_KNOWLEDGE_MIGRATION_BROKEN_LINK_REPORT.md",
    "05_OUTPUTS\\release_readiness\\POST_KNOWLEDGE_MIGRATION_SECURITY_SCAN.md",
    "05_OUTPUTS\\release_readiness\\POST_KNOWLEDGE_MIGRATION_NEXT_STEPS.md",
    "02_HISTORY\\sessions\\POST_KNOWLEDGE_MIGRATION_REPO_INTEGRITY_SESSION.md",
    "02_HISTORY\\command_logs\\POST_KNOWLEDGE_MIGRATION_REPO_INTEGRITY_COMMANDS.md",
    "02_HISTORY\\ai_self_reviews\\20260512_POST_KNOWLEDGE_MIGRATION_REPO_INTEGRITY_SELF_REVIEW.md",
    "02_HISTORY\\ai_scorecards\\20260512_POST_KNOWLEDGE_MIGRATION_REPO_INTEGRITY_SCORECARD.md",
    "02_HISTORY\\claim_evidence_matrices\\20260512_POST_KNOWLEDGE_MIGRATION_REPO_INTEGRITY_CLAIM_EVIDENCE.md",
    "02_HISTORY\\uncertainty_logs\\20260512_POST_KNOWLEDGE_MIGRATION_REPO_INTEGRITY_UNCERTAINTY_LOG.md",
    "02_HISTORY\\hallucination_risk_logs\\20260512_POST_KNOWLEDGE_MIGRATION_REPO_INTEGRITY_RISK_LOG.md",
    "02_HISTORY\\issue_logs\\20260512_post_migration_repo_push_blockers.md",
    "02_HISTORY\\sessions\\2026-05-12_post_knowledge_migration_repo_integrity_audit_task_contract.json",
    "02_HISTORY\\sessions\\2026-05-12_post_knowledge_migration_repo_integrity_audit_task_contract_report.md",
    "00_CODEX_START\\AI_QUALITY_INDEX.generated.json",
    "00_CODEX_START\\AI_QUALITY_INDEX.generated.md",
    "00_CODEX_START\\CURRENT_KNOWN_PROBLEMS.generated.json",
    "00_CODEX_START\\CURRENT_KNOWN_PROBLEMS.md",
    "00_CODEX_START\\HISTORY_INDEX.generated.json",
    "00_CODEX_START\\HISTORY_INDEX.generated.md",
    "00_CODEX_START\\MEMORY_INDEX.generated.json",
    "00_CODEX_START\\MEMORY_INDEX.generated.md",
    "00_CODEX_START\\REPO_INDEX.generated.json",
    "00_CODEX_START\\REPO_INDEX.generated.md",
    "01_MEMORY\\MASTER_MEMORY_INDEX.md",
    "02_HISTORY\\MASTER_HISTORY_INDEX.md"
  ],
  "declared_final_status": "VALID_TASK_CONTRACT",
  "notes": "Audit-only task. No KiCad design files were intentionally edited. The repo is not ready to push yet because the root-local .sfdx directory is untracked and not ignored.",
  "evidence": {
    "backup_created": false,
    "backup_path": "",
    "no_design_change_needed": true,
    "drc_run": false,
    "visual_export_attempted": false,
    "knowledge_scrape_removed": true,
    "broken_link_scan_checked": 54,
    "broken_link_scan_missing": 0,
    "source_registry_csv_rows": 10236,
    "source_registry_json_parse": true,
    "public_payload_exclusion_pass": true,
    "script_compile_pass": true,
    "staged_large_files": 0,
    "root_sfdx_present": true,
    "root_sfdx_secret_hits": 0,
    "kicad_design_files_changed": false
  }
}
