{
  "task_type": "AUDIT_ONLY",
  "task_summary": "Audit why KICAD_ENGINE allowed ERC-clean but visually weak schematics, identify exact workflow/rule/tool gaps, and record a repair-ready repo-level hardening plan without editing KiCad design files.",
  "project_path": ".",
  "target_pcb": null,
  "changed_files": [
    "05_OUTPUTS/release_readiness/SCHEMATIC_HUMAN_DRAFTING_ROOT_CAUSE_AUDIT.md",
    "02_HISTORY/sessions/SCHEMATIC_HUMAN_DRAFTING_ROOT_CAUSE_AUDIT_SESSION.md",
    "02_HISTORY/command_logs/SCHEMATIC_HUMAN_DRAFTING_ROOT_CAUSE_AUDIT_COMMANDS.md",
    "02_HISTORY/ai_self_reviews/SCHEMATIC_HUMAN_DRAFTING_ROOT_CAUSE_AUDIT_AI_SELF_REVIEW.md",
    "02_HISTORY/ai_scorecards/SCHEMATIC_HUMAN_DRAFTING_ROOT_CAUSE_AUDIT_SCORECARD.md",
    "02_HISTORY/claim_evidence_matrices/SCHEMATIC_HUMAN_DRAFTING_ROOT_CAUSE_AUDIT_CLAIM_EVIDENCE_MATRIX.md",
    "02_HISTORY/uncertainty_logs/SCHEMATIC_HUMAN_DRAFTING_ROOT_CAUSE_AUDIT_UNCERTAINTY_LOG.md",
    "02_HISTORY/hallucination_risk_logs/SCHEMATIC_HUMAN_DRAFTING_ROOT_CAUSE_AUDIT_HALLUCINATION_RISK_LOG.md",
    "02_HISTORY/issue_logs/SCHEMATIC_HUMAN_DRAFTING_WORKFLOW_REPAIR_GAPS.md",
    "02_HISTORY/user_corrections/SCHEMATIC_HUMAN_DRAFTING_MANUAL_BASELINE_CORRECTION.md",
    "02_HISTORY/failed_attempts/SCHEMATIC_HUMAN_DRAFTING_ROOT_CAUSE_AUDIT_FAILED_ATTEMPTS.md",
    "05_OUTPUTS/release_readiness/SCHEMATIC_HUMAN_DRAFTING_ROOT_CAUSE_AUDIT_TASK_CONTRACT.json",
    "05_OUTPUTS/release_readiness/SCHEMATIC_HUMAN_DRAFTING_ROOT_CAUSE_AUDIT_TASK_CONTRACT_REPORT.md",
    "00_CODEX_START/REPO_INDEX.generated.json",
    "00_CODEX_START/REPO_INDEX.generated.md",
    "01_MEMORY/MASTER_MEMORY_INDEX.md",
    "00_CODEX_START/MEMORY_INDEX.generated.json",
    "00_CODEX_START/MEMORY_INDEX.generated.md",
    "02_HISTORY/MASTER_HISTORY_INDEX.md",
    "00_CODEX_START/HISTORY_INDEX.generated.json",
    "00_CODEX_START/HISTORY_INDEX.generated.md",
    "00_CODEX_START/AI_QUALITY_INDEX.generated.json",
    "00_CODEX_START/AI_QUALITY_INDEX.generated.md",
    "00_CODEX_START/CURRENT_KNOWN_PROBLEMS.md"
  ],
  "declared_final_status": "VALID_TASK_CONTRACT",
  "notes": "Repo-level audit only. No KiCad design files are allowed to change.",
  "evidence": {
    "backup_created": false,
    "drc_run": false,
    "visual_export_attempted": false
  }
}
