{
  "task_type": "DOCS_ONLY",
  "task_summary": "Patch KICAD_ENGINE schematic drafting rules, prompts, and route/blocker docs so schematic creation and repair uses human drafting rules before local net labels and before gate claims, without editing KiCad design files.",
  "project_path": ".",
  "target_pcb": null,
  "changed_files": [
    "34_SCHEMATIC_QUALITY_ENGINE/README.md",
    "34_SCHEMATIC_QUALITY_ENGINE/SCHEMATIC_WIRING_VS_LABEL_RULES.md",
    "34_SCHEMATIC_QUALITY_ENGINE/SCHEMATIC_READABILITY_STANDARD.md",
    "34_SCHEMATIC_QUALITY_ENGINE/SCHEMATIC_BLOCK_LAYOUT_RULES.md",
    "34_SCHEMATIC_QUALITY_ENGINE/SCHEMATIC_VISUAL_AUDIT_RULES.md",
    "34_SCHEMATIC_QUALITY_ENGINE/LOCAL_WIRING_STYLE_GUIDE.md",
    "09_ACCURACY_ENGINE/schematic_rules/WIRE_VS_NET_LABEL_RULES.md",
    "09_ACCURACY_ENGINE/schematic_rules/READABLE_SCHEMATIC_FLOW_RULES.md",
    "09_ACCURACY_ENGINE/schematic_rules/REFERENCE_VALUE_TEXT_PLACEMENT_RULES.md",
    "09_ACCURACY_ENGINE/schematic_rules/ESP32_BOOT_RESET_RULES.md",
    "09_ACCURACY_ENGINE/verification_rules/HUMAN_READABLE_SCHEMATIC_RULES.md",
    "09_ACCURACY_ENGINE/checklists/SCHEMATIC_HUMAN_READABILITY_CHECKLIST.md",
    "00_CODEX_START/TASK_TYPE_TO_REQUIRED_DOCS.md",
    "00_CODEX_START/TASK_TYPE_TO_RULE_MAP.md",
    "00_CODEX_START/TASK_TYPE_TO_BLOCKERS.md",
    ".prompts/shared/HUMAN_DRAFTING_MODE.md",
    ".prompts/kicad_pipeline/02_schematic_visual_cleanup.md",
    ".prompts/kicad_pipeline/02_schematic_visual_closeup_audit.md",
    ".prompts/kicad_pipeline/03_schematic_visual_repair.md",
    ".prompts/kicad_pipeline/03_schematic_electrical_review.md",
    ".prompts/codex/05_PLAN_SCHEMATIC.md",
    ".prompts/codex/06_REVIEW_SCHEMATIC.md",
    ".prompts/claude/05_PLAN_SCHEMATIC.md",
    ".prompts/claude/06_REVIEW_SCHEMATIC.md",
    "README_GPT.md",
    "FOR CHAT GPT.MD",
    "05_OUTPUTS/release_readiness/SCHEMATIC_HUMAN_DRAFTING_RULE_PATCH_REPORT.md",
    "02_HISTORY/sessions/SCHEMATIC_HUMAN_DRAFTING_RULE_PATCH_SESSION.md",
    "02_HISTORY/command_logs/SCHEMATIC_HUMAN_DRAFTING_RULE_PATCH_COMMANDS.md",
    "02_HISTORY/ai_self_reviews/SCHEMATIC_HUMAN_DRAFTING_RULE_PATCH_AI_SELF_REVIEW.md",
    "02_HISTORY/ai_scorecards/SCHEMATIC_HUMAN_DRAFTING_RULE_PATCH_SCORECARD.md",
    "02_HISTORY/claim_evidence_matrices/SCHEMATIC_HUMAN_DRAFTING_RULE_PATCH_CLAIM_EVIDENCE_MATRIX.md",
    "02_HISTORY/uncertainty_logs/SCHEMATIC_HUMAN_DRAFTING_RULE_PATCH_UNCERTAINTY_LOG.md",
    "02_HISTORY/hallucination_risk_logs/SCHEMATIC_HUMAN_DRAFTING_RULE_PATCH_HALLUCINATION_RISK_LOG.md",
    "02_HISTORY/issue_logs/SCHEMATIC_HUMAN_DRAFTING_RULE_PATCH_TOOLING_FOLLOWUP.md",
    "05_OUTPUTS/release_readiness/SCHEMATIC_HUMAN_DRAFTING_RULE_PATCH_TASK_CONTRACT.json",
    "05_OUTPUTS/release_readiness/SCHEMATIC_HUMAN_DRAFTING_RULE_PATCH_TASK_CONTRACT_REPORT.md",
    "00_CODEX_START/REPO_INDEX.generated.json",
    "00_CODEX_START/REPO_INDEX.generated.md",
    "01_MEMORY/MASTER_MEMORY_INDEX.md",
    "00_CODEX_START/MEMORY_INDEX.generated.json",
    "00_CODEX_START/MEMORY_INDEX.generated.md",
    "02_HISTORY/MASTER_HISTORY_INDEX.md",
    "00_CODEX_START/HISTORY_INDEX.generated.json",
    "00_CODEX_START/HISTORY_INDEX.generated.md",
    "00_CODEX_START/AI_QUALITY_INDEX.generated.json",
    "00_CODEX_START/AI_QUALITY_INDEX.generated.md",
    "00_CODEX_START/CURRENT_KNOWN_PROBLEMS.md"
  ],
  "declared_final_status": "VALID_TASK_CONTRACT",
  "notes": "Rule and prompt repair only. No KiCad design files, PCB files, or fabrication outputs are allowed to change.",
  "evidence": {
    "backup_created": false,
    "drc_run": false,
    "visual_export_attempted": false
  }
}
