{
  "task_type": "GITHUB_DOCS_ONLY",
  "task_summary": "Validate whether the schematic human-drafting engine improvements can be safely staged, committed, and pushed without including KiCad design files or files outside the user's allowed include list.",
  "project_path": ".",
  "target_pcb": null,
  "changed_files": [
    "05_OUTPUTS/release_readiness/SCHEMATIC_HUMAN_DRAFTING_PUSH_VALIDATION.md",
    "05_OUTPUTS/release_readiness/SCHEMATIC_HUMAN_DRAFTING_PUSH_TASK_CONTRACT.json",
    "05_OUTPUTS/release_readiness/SCHEMATIC_HUMAN_DRAFTING_PUSH_TASK_CONTRACT_REPORT.md",
    "02_HISTORY/sessions/SCHEMATIC_HUMAN_DRAFTING_PUSH_VALIDATION_SESSION.md",
    "02_HISTORY/command_logs/SCHEMATIC_HUMAN_DRAFTING_PUSH_VALIDATION_COMMANDS.md"
  ],
  "declared_final_status": "VALID_TASK_CONTRACT",
  "notes": "Push-validation and blocker-report task only. No KiCad design files are allowed to change. No commit or push may occur if validation exposes scope, safety, or dependency blockers.",
  "evidence": {
    "backup_created": false,
    "drc_run": false,
    "visual_export_attempted": false
  }
}
