{
  "task_type": "AUDIT_ONLY",
  "task_summary": "Complete the schematic visual cleanup and layout engine, wire it into repo rules/prompts, and run a read-only readability review against ESP32_CSI_WIFI_NODE.",
  "project_path": "C:\\Users\\LJ\\GitHub\\KICAD_ENGINE",
  "target_pcb": null,
  "changed_files": [
    "03_TOOLS\\scripts\\schematic_layout\\README.md",
    "03_TOOLS\\scripts\\schematic_layout\\schematic_layout_common.py",
    "03_TOOLS\\scripts\\schematic_layout\\score_schematic_readability.py",
    "03_TOOLS\\scripts\\schematic_layout\\plan_schematic_block_layout.py",
    "03_TOOLS\\scripts\\schematic_layout\\rewrite_schematic_layout_safe.py",
    "03_TOOLS\\scripts\\schematic_layout\\render_schematic_review_pages.py",
    "34_SCHEMATIC_QUALITY_ENGINE\\README.md",
    "34_SCHEMATIC_QUALITY_ENGINE\\README_FOR_CODEX_AND_CLAUDE.md",
    "34_SCHEMATIC_QUALITY_ENGINE\\SCHEMATIC_LAYOUT_ALGORITHM.md",
    "34_SCHEMATIC_QUALITY_ENGINE\\FUNCTIONAL_BLOCK_TEMPLATES.md",
    "34_SCHEMATIC_QUALITY_ENGINE\\LOCAL_WIRING_STYLE_GUIDE.md",
    "34_SCHEMATIC_QUALITY_ENGINE\\VISUAL_READABILITY_SCORECARD.md",
    "09_ACCURACY_ENGINE\\schematic_rules\\READABLE_SCHEMATIC_FLOW_RULES.md",
    "09_ACCURACY_ENGINE\\schematic_rules\\WIRE_VS_NET_LABEL_RULES.md",
    "09_ACCURACY_ENGINE\\checklists\\SCHEMATIC_READY_FOR_PCB_CHECKLIST.md",
    "00_CODEX_START\\TASK_TYPE_TO_REQUIRED_DOCS.md",
    "START_HERE_FOR_AI_AGENTS.md",
    "README_GPT.md",
    "FOR CHAT GPT.MD",
    ".prompts\\kicad_pipeline\\02_schematic_visual_cleanup.md",
    ".prompts\\kicad_pipeline\\03_schematic_electrical_review.md",
    "01_MEMORY\\DESIGN_RULES_MEMORY.md",
    "04_KICAD_PROJECTS\\active\\ESP32_CSI_WIFI_NODE\\memory\\CURRENT_BLOCKERS.md",
    "04_KICAD_PROJECTS\\active\\ESP32_CSI_WIFI_NODE\\memory\\PROJECT_MEMORY.md",
    "02_HISTORY\\issue_logs\\20260510_ESP32_CSI_WIFI_NODE_SCHEMATIC_LAYOUT_FAIL.md",
    "02_HISTORY\\design_reviews\\SCHEMATIC_LAYOUT_ENGINE_AUDIT.md",
    "02_HISTORY\\sessions\\SCHEMATIC_LAYOUT_ENGINE_SESSION.md",
    "02_HISTORY\\command_logs\\SCHEMATIC_LAYOUT_ENGINE_COMMANDS.md"
  ],
  "declared_final_status": "VALID_TASK_CONTRACT",
  "notes": "Tooling, docs, and rules work only. Read-only layout review packet executed on ESP32_CSI_WIFI_NODE. No KiCad design files were edited.",
  "evidence": {
    "backup_created": false,
    "no_design_change_needed": true,
    "drc_run": false,
    "drc_report_path": "04_KICAD_PROJECTS\\active\\ESP32_CSI_WIFI_NODE\\reports\\schematic_layout\\20260510_113053\\erc_report.raw.txt",
    "visual_export_attempted": false,
    "visual_paths": [
      "04_KICAD_PROJECTS\\active\\ESP32_CSI_WIFI_NODE\\reports\\schematic_layout\\20260510_113053\\SCHEMATIC_LAYOUT_REVIEW.md",
      "04_KICAD_PROJECTS\\active\\ESP32_CSI_WIFI_NODE\\reports\\schematic_layout\\20260510_113053\\schematic_readability_score.md",
      "04_KICAD_PROJECTS\\active\\ESP32_CSI_WIFI_NODE\\reports\\schematic_layout\\20260510_113053\\visual_flow.md",
      "04_KICAD_PROJECTS\\active\\ESP32_CSI_WIFI_NODE\\reports\\schematic_layout\\20260510_113053\\local_wire_usage.md"
    ]
  }
}
