{
  "task_type": "AUDIT_ONLY",
  "task_summary": "Create a schematic quality engine with rules, schemas, tooling, routing updates, and read-only validation for schematic readability and PCB-update readiness.",
  "project_path": "C:\\Users\\LJ\\GitHub\\KICAD_ENGINE",
  "target_pcb": null,
  "changed_files": [
    "34_SCHEMATIC_QUALITY_ENGINE\\README.md",
    "34_SCHEMATIC_QUALITY_ENGINE\\SCHEMATIC_READABILITY_STANDARD.md",
    "34_SCHEMATIC_QUALITY_ENGINE\\SCHEMATIC_BLOCK_LAYOUT_RULES.md",
    "34_SCHEMATIC_QUALITY_ENGINE\\SCHEMATIC_WIRING_VS_LABEL_RULES.md",
    "34_SCHEMATIC_QUALITY_ENGINE\\SCHEMATIC_ANNOTATION_GATE.md",
    "34_SCHEMATIC_QUALITY_ENGINE\\SCHEMATIC_FOOTPRINT_GATE.md",
    "34_SCHEMATIC_QUALITY_ENGINE\\SCHEMATIC_VISUAL_AUDIT_RULES.md",
    "34_SCHEMATIC_QUALITY_ENGINE\\SCHEMATIC_TO_PCB_READY_GATE.md",
    "34_SCHEMATIC_QUALITY_ENGINE\\SCHEMATIC_COMMON_FAILURES.md",
    "34_SCHEMATIC_QUALITY_ENGINE\\README_FOR_CODEX_AND_CLAUDE.md",
    "34_SCHEMATIC_QUALITY_ENGINE\\schemas\\schematic_quality_result.schema.json",
    "34_SCHEMATIC_QUALITY_ENGINE\\schemas\\schematic_block.schema.json",
    "34_SCHEMATIC_QUALITY_ENGINE\\schemas\\schematic_symbol_audit.schema.json",
    "03_TOOLS\\scripts\\schematic_quality\\README.md",
    "03_TOOLS\\scripts\\schematic_quality\\extract_schematic_symbols.py",
    "03_TOOLS\\scripts\\schematic_quality\\audit_schematic_annotation.py",
    "03_TOOLS\\scripts\\schematic_quality\\audit_schematic_footprints.py",
    "03_TOOLS\\scripts\\schematic_quality\\audit_schematic_text_overlaps.py",
    "03_TOOLS\\scripts\\schematic_quality\\audit_schematic_block_layout.py",
    "03_TOOLS\\scripts\\schematic_quality\\audit_wire_vs_label_balance.py",
    "03_TOOLS\\scripts\\schematic_quality\\generate_schematic_quality_report.py",
    "03_TOOLS\\scripts\\schematic_quality\\run_schematic_quality_gate.py",
    "03_TOOLS\\scripts\\schematic_quality\\schematic_quality_common.py",
    "09_ACCURACY_ENGINE\\schematic_rules\\READABLE_SCHEMATIC_FLOW_RULES.md",
    "09_ACCURACY_ENGINE\\schematic_rules\\WIRE_VS_NET_LABEL_RULES.md",
    "09_ACCURACY_ENGINE\\schematic_rules\\FUNCTIONAL_BLOCK_SPACING_RULES.md",
    "09_ACCURACY_ENGINE\\schematic_rules\\REFERENCE_VALUE_TEXT_PLACEMENT_RULES.md",
    "09_ACCURACY_ENGINE\\schematic_rules\\NATIVE_ANNOTATION_REQUIRED_RULES.md",
    "09_ACCURACY_ENGINE\\schematic_rules\\FOOTPRINT_ASSIGNMENT_REQUIRED_RULES.md",
    "09_ACCURACY_ENGINE\\schematic_rules\\NEEDS_REVIEW_MARKER_RULES.md",
    "START_HERE_FOR_AI_AGENTS.md",
    "00_CODEX_START\\TASK_ROUTER.md",
    "00_CODEX_START\\TASK_TYPE_TO_REQUIRED_DOCS.md",
    "00_CODEX_START\\TASK_TYPE_TO_ALLOWED_ACTIONS.md",
    "00_CODEX_START\\TASK_TYPE_TO_BLOCKERS.md",
    "00_CODEX_START\\TASK_TYPE_TO_OUTPUTS.md",
    ".prompts\\kicad_pipeline\\01_schematic_annotation_and_completeness.md",
    ".prompts\\kicad_pipeline\\02_schematic_visual_closeup_audit.md",
    ".prompts\\kicad_pipeline\\06_schematic_to_pcb_gate.md",
    "README_GPT.md",
    "FOR CHAT GPT.MD",
    "AGENTS.md",
    "01_MEMORY\\DESIGN_RULES_MEMORY.md",
    "04_KICAD_PROJECTS\\active\\ESP32_CSI_WIFI_NODE\\memory\\PROJECT_MEMORY.md",
    "04_KICAD_PROJECTS\\active\\ESP32_CSI_WIFI_NODE\\memory\\CURRENT_BLOCKERS.md",
    "02_HISTORY\\design_reviews\\SCHEMATIC_QUALITY_ENGINE_CREATION_AUDIT.md",
    "02_HISTORY\\sessions\\SCHEMATIC_QUALITY_ENGINE_CREATION_SESSION.md",
    "02_HISTORY\\command_logs\\SCHEMATIC_QUALITY_ENGINE_CREATION_COMMANDS.md"
  ],
  "declared_final_status": "VALID_TASK_CONTRACT",
  "notes": "Repo tooling/docs/rules work only. Read-only dry-run gate executed on ESP32_CSI_WIFI_NODE. No KiCad design files were edited.",
  "evidence": {
    "backup_created": false,
    "no_design_change_needed": true,
    "drc_run": false,
    "drc_report_path": "04_KICAD_PROJECTS\\active\\ESP32_CSI_WIFI_NODE\\reports\\schematic_quality\\20260510_104847\\erc_report.raw.txt",
    "visual_export_attempted": false,
    "visual_paths": [
      "04_KICAD_PROJECTS\\active\\ESP32_CSI_WIFI_NODE\\reports\\schematic_quality\\20260510_104847\\schematic_quality_report.md",
      "04_KICAD_PROJECTS\\active\\ESP32_CSI_WIFI_NODE\\reports\\schematic_quality\\20260510_104847\\footprints.md",
      "04_KICAD_PROJECTS\\active\\ESP32_CSI_WIFI_NODE\\reports\\schematic_quality\\20260510_104847\\text_overlaps.md",
      "04_KICAD_PROJECTS\\active\\ESP32_CSI_WIFI_NODE\\reports\\schematic_quality\\20260510_104847\\wire_vs_label.md"
    ]
  }
}
